{
  "$schema": "https://raw.githubusercontent.com/RKInnovate/rkload/main/schemas/v1/config.schema.json",
  "version": 1,

  "GET": [
    {
      "name": "root",
      "url": "https://api.example.com/",
      "headers": {},
      "body": "",
      "c": 200,
      "requests": 500
    },
    {
      "name": "billing-plans",
      "url": "https://api.example.com/api/v1/billing/plans",
      "headers": {},
      "body": "",
      "c": 100,
      "requests": 1000
    },
    {
      "name": "desktop-validate-key",
      "url": "https://api.example.com/api/v1/desktop/validate-key",
      "headers": {
        "x-api-key": "REPLACE_WITH_YOUR_KEY"
      },
      "body": "",
      "c": 50,
      "requests": 500
    }
  ],

  "POST": [
    {
      "name": "auth-login",
      "url": "https://api.example.com/api/v1/auth/login",
      "headers": {
        "Content-Type": "application/json"
      },
      "body": "{\"email\":\"user@example.com\",\"password\":\"REPLACE_ME\",\"totp_code\":null}",
      "c": 100,
      "requests": 200
    }
  ],

  "DELETE": []
}
